{"$schema":"https://schemas.orbyss.io/program-kit/serialization/1.0.0/profile-source.schema.json","builtInConverterTargets":["Orbyss.ProgramKit.Artifacts.Primitives.ProgramKitIdentifier, Orbyss.ProgramKit.Artifacts","Orbyss.ProgramKit.Artifacts.Primitives.SemanticVersion, Orbyss.ProgramKit.Artifacts","Orbyss.ProgramKit.Artifacts.Primitives.SemanticVersionRange, Orbyss.ProgramKit.Artifacts","Orbyss.ProgramKit.Artifacts.Primitives.Sha256Digest, Orbyss.ProgramKit.Artifacts"],"builtInMetadataTargets":[],"canonicalizationProfile":{"digest":"sha256:5f6b81547f1c025ec20fafbd5701b4506970cb58ca89e1679ebbe40a9551aa8b","identity":"pkid:profile:program-kit:canonical-json-rfc8785","version":"1.0.0"},"digestRule":"sha256-of-exact-utf8-source-bytes-with-lf-and-no-bom","extensibility":"explicit-contributions","identity":"pkid:profile:program-kit:json-contracts","maximumLimits":{"maxBufferedObjectBytes":1048576,"maxDepth":64,"maxObjectMembers":16384,"maxTokens":1000000,"maxUtf8Bytes":1048576},"ownedMechanicsSources":[{"digest":"sha256:76771341ad41cfba678fea41edc78fc4bf8b93cad1bc6028e8a43db885c9e825","relativePath":"Orbyss.ProgramKit.Serialization.JSON/Composition/BuiltInPrimitiveConverterComposition.cs"},{"digest":"sha256:a0a6648828195e67c95d8a4c9b1d2c6066823ada0d95bbd22fa55a5fab17774b","relativePath":"Orbyss.ProgramKit.Serialization.JSON/Composition/ExactDecimalStringConverterPolicy.cs"},{"digest":"sha256:3625afc32718a86a38d79deeed6354c4b25245826e2da7c47226e24ce2343dab","relativePath":"Orbyss.ProgramKit.Serialization.JSON/Composition/FrozenJsonProfile.cs"},{"digest":"sha256:2fab3c229a58477f00d2f7891f1efdc34e4752cee49a0850ae7db42260135fd7","relativePath":"Orbyss.ProgramKit.Serialization.JSON/Composition/ProgramKitJsonBuilder.cs"},{"digest":"sha256:15f4bebaaf789548c71b54aad5e511cf08a0cd569bfb305223acfb4c3a359218","relativePath":"Orbyss.ProgramKit.Serialization.JSON/Composition/ProgramKitJsonBuilderState.cs"},{"digest":"sha256:5e8391bcc689f1253a1664b79d2f868155c1cd45a8ebd73be23c3316963b2c66","relativePath":"Orbyss.ProgramKit.Serialization.JSON/Composition/ProgramKitJsonRegistrationMarker.cs"},{"digest":"sha256:32ff2d6c28f74a406db82e5ca62622bcd139f85bc254ec8c66c8098fabcb01b0","relativePath":"Orbyss.ProgramKit.Serialization.JSON/Composition/ProgramKitJsonRegistry.cs"},{"digest":"sha256:8d572d68c852fbe8564b3a929f5626238ef1b8b669e2dd8920966ec2ae651d03","relativePath":"Orbyss.ProgramKit.Serialization.JSON/Composition/ProgramKitJsonRegistryFactory.cs"},{"digest":"sha256:e2b447c0248a7a17a9b356904ae09044dcf1c10dc4feefe64d5a5e561bf5a255","relativePath":"Orbyss.ProgramKit.Serialization.JSON/Composition/ProgramKitJsonRegistryKey.cs"},{"digest":"sha256:346907bb382ac628b0150a9b092caae5a83290c554a55b0aedb6a57a805eafc0","relativePath":"Orbyss.ProgramKit.Serialization.JSON/Composition/ProgramKitJsonServiceCollectionExtensions.cs"},{"digest":"sha256:9797604a272ed4ab0aca9122d2fe169f2712734ea5d631d699a89b911dff7ea5","relativePath":"Orbyss.ProgramKit.Serialization.JSON/Contributions/JsonContributionTargetContract.cs"},{"digest":"sha256:8eb9ea9390f89d20a8b13c8dec6944185de231715fea3a6fea7a93295ac8ab9f","relativePath":"Orbyss.ProgramKit.Serialization.JSON/Contributions/JsonConverterFactoryContribution.cs"},{"digest":"sha256:b256692eee0cacb1b39510d8155b01e883f9f3da5a51e482ac75da271d761847","relativePath":"Orbyss.ProgramKit.Serialization.JSON/Contributions/JsonSerializationContribution.cs"},{"digest":"sha256:5ff3feab89ceea963b417dfdd630405b91e0098ee84608f10f43af332d1d08a4","relativePath":"Orbyss.ProgramKit.Serialization.JSON/Contributions/JsonTypeInfoResolverContribution.cs"},{"digest":"sha256:af27dfd97fd79e5c5db60705e99be1c76a112522b8bf118715e63131dbd9722d","relativePath":"Orbyss.ProgramKit.Serialization.JSON/Contributions/TypedJsonConverterContribution.cs"},{"digest":"sha256:15aa90691237bc76ad55a3017855e936702edf00fe0e7ed192bf78e1f264c0b9","relativePath":"Orbyss.ProgramKit.Serialization.JSON/Converters/DeclaredTargetJsonConverterFactory.cs"},{"digest":"sha256:152e1f55b2bf6d3277396b01d0ded70e5e2a8f96ab6ae8309708c5f42f43245e","relativePath":"Orbyss.ProgramKit.Serialization.JSON/Converters/ExactDecimalStringJsonConverter.cs"},{"digest":"sha256:7eeb5ad45ca0d9ac6a61325909ee3f14c05b89cb3361e5ffed321d7730707f0e","relativePath":"Orbyss.ProgramKit.Serialization.JSON/Converters/ProgramKitIdentifierJsonConverter.cs"},{"digest":"sha256:8b7eacd71f2bb78d6402e90a8c9a235f6d18ac8be905ed9370cb87a59474c7ab","relativePath":"Orbyss.ProgramKit.Serialization.JSON/Converters/SemanticVersionJsonConverter.cs"},{"digest":"sha256:dfcb7aff3a78290173ebc220c0c48d3385bf8bda7a5ed3176aa3e9e3fb5190a5","relativePath":"Orbyss.ProgramKit.Serialization.JSON/Converters/SemanticVersionRangeJsonConverter.cs"},{"digest":"sha256:574874100b0de136418a5bf4c2d15fe0deab80c547304d54170ab73d1e121da3","relativePath":"Orbyss.ProgramKit.Serialization.JSON/Converters/Sha256DigestJsonConverter.cs"},{"digest":"sha256:64e38d88da3ddefd13ae1fc5017d19707b7bdab837503577fb5dfacc5b67e481","relativePath":"Orbyss.ProgramKit.Serialization.JSON/Diagnostics/JsonExceptionBoundary.cs"},{"digest":"sha256:9559ee165e9e7da0adc3a5e4eebaf43cbfdcc3f107c1d1a46cb09b2cc048f877","relativePath":"Orbyss.ProgramKit.Serialization.JSON/Diagnostics/ProgramKitJsonDiagnosticIds.cs"},{"digest":"sha256:34dd427b12f2a7a78a1c6b2525605da863b474b58ffefbffa0251e4fdc93409e","relativePath":"Orbyss.ProgramKit.Serialization.JSON/Diagnostics/ProgramKitJsonException.cs"},{"digest":"sha256:775d2c38823cace9fb518aceefa1ced9f042885e57597a4a58054402e67b1606","relativePath":"Orbyss.ProgramKit.Serialization.JSON/Metadata/DeclaredTargetJsonTypeInfoResolver.cs"},{"digest":"sha256:f8cebbf88c85f823ddca5ad44e4d16f4bd58245d94545915ca9c413a9f4b3f4d","relativePath":"Orbyss.ProgramKit.Serialization.JSON/Metadata/JsonTargetTypeIdentity.cs"},{"digest":"sha256:a4a04febc39dab3b24cedfd749d07ac1f5fa1c46a892e8081f6526eeef890531","relativePath":"Orbyss.ProgramKit.Serialization.JSON/Metadata/NullJsonTypeInfoResolver.cs"},{"digest":"sha256:cd84dcd8809b5dde65ef14cfbf71e8df7631ed4c04e53361d5c9e1935de79064","relativePath":"Orbyss.ProgramKit.Serialization.JSON/Profiles/JsonProfileOwnedConverter.cs"},{"digest":"sha256:0e88ca0579fb70d93a2b6d5390c0cf1758db1541fc2e903787287a48e640d7f6","relativePath":"Orbyss.ProgramKit.Serialization.JSON/Profiles/JsonProfileOwnedMechanics.cs"},{"digest":"sha256:1e0be9daf9a930b0c5c748f6925231ae6fccb7eaae35b4ecb96410d5d73ba0bd","relativePath":"Orbyss.ProgramKit.Serialization.JSON/Profiles/JsonSerializationLimits.cs"},{"digest":"sha256:b2b816e96cb34be5dda4d40bf00148a7bc51489bbde78b9e5c293e6999f6b804","relativePath":"Orbyss.ProgramKit.Serialization.JSON/Serialization/BoundedJsonBufferWriter.cs"},{"digest":"sha256:c3bbff80acbab7d7192fed1096df3578258ebca1c321ee47d749dcd6acd75cf8","relativePath":"Orbyss.ProgramKit.Serialization.JSON/Serialization/JsonByteLimitExceededException.cs"},{"digest":"sha256:51d5863a97f58c4a0b168fdbad25cc8f255bd1650255b22be7ec56f7b805231c","relativePath":"Orbyss.ProgramKit.Serialization.JSON/Serialization/ProgramKitJsonSerializer.cs"}],"profileKind":"serialization","rules":["source-generated-metadata-only","schema-declared-property-names","case-sensitive-reads","comments-disallowed","trailing-commas-disallowed","unmapped-members-disallowed","null-properties-written","strict-numbers","reference-preservation-disallowed","nfc-strings-required"],"version":"1.0.0"}